Main Keyword,Pillar Topic,Blog Post,Blog Post Outline,Search Volume
PayRoll,,,,
,Payroll Compliance,State-Specific Payroll,"Understanding Regional Regulations, Navigating Multi-State Compliance, State Tax Withholding Nuances, Wage and Hour Law Differences, State Unemployment Insurance, Local Leave Laws Overview, Payroll Reporting Requirements by State, Handling State-Specific Garnishments, Regional Minimum Wage Variations, State Payroll Audit Preparedness",1
,Payroll Compliance,Payroll Compliance,"Ensuring Federal and State Compliance, Navigating FLSA Rules, Understanding Payroll Tax Obligations, Key Payroll Documentation, Regular Compliance Audits, Addressing Payroll Errors, Keeping Up with Legislative Changes, Employee Classification Challenges, Data Security in Payroll, Developing a Compliance Checklist",1
,Payroll Compliance,Tax Rules for Payroll,"Understanding Federal Tax Obligations, Navigating State Tax Variations, Employee vs. Contractor Tax Rules, Payroll Tax Filing Best Practices, Managing Taxable Employee Benefits, Year-End Tax Considerations, IRS Audits and Compliance, Utilizing Tax Credits and Incentives, International Employee Taxation, Recordkeeping for Tax Purposes",1
,Payroll Compliance,Remote Worker Pay Laws,"Navigating Multi-State Compliance, Tax Implications for Remote Employees, Setting Up Out-of-State Payroll, Legal Considerations for Remote Work, Remote Work Payroll Policies, Handling Time Tracking and Overtime, Data Security for Remote Payroll, International Remote Employee Laws, Benefits Administration for Remote Workers, Remote Worker Classification Issues",1
,Payroll Compliance,Payroll Audit Strategies,"Preparing for a Payroll Audit, Identifying and Correcting Discrepancies, Managing Audit Documentation, Internal vs. External Audits, Common Payroll Audit Issues, Audit Risk Management, Leveraging Payroll Software in Audits, Communicating with Auditors, Post-Audit Action Plan, Preventive Measures for Future Audits",1
,Payroll Compliance,Payroll Software Tips,"Choosing the Right Payroll Software, Integrating Payroll with HR Systems, Automating Payroll Processes, Ensuring Software Compliance, Data Security in Payroll Software, Software Training for Staff, Customizing Payroll Reports, Handling Software Updates and Upgrades, Evaluating Software Performance, Exploring Advanced Software Features",1
,Payroll Compliance,Minimum Wage Updates,"Tracking State and Federal Changes, Impact on Payroll Calculations, Communicating Changes to Employees, Adjusting Payroll Systems for New Rates, Minimum Wage vs. Living Wage, Minimum Wage Exemptions, Economic Impact of Wage Increases, Wage Compression Issues, Planning for Future Increases, Advocacy and Minimum Wage Laws",1
,Payroll Compliance,Overtime Pay Guidelines,"Understanding FLSA Overtime Rules, Calculating Overtime Correctly, Exempt vs. Non-Exempt Employees, State-specific Overtime Regulations, Managing Overtime Policies, Automating Overtime Tracking, Handling Overtime Disputes, Overtime and Remote Workers, Overtime Impact on Payroll Budget, Future Trends in Overtime Legislation",1
,Payroll Compliance,Employee Benefit Rules,"Navigating Benefit Compliance, Tax Implications of Employee Benefits, Managing Retirement Plan Contributions, Health Insurance Compliance, Time-Off Benefits and Payroll, Fringe Benefits and Taxation, Recordkeeping for Benefits, Communicating Benefits to Employees, Audits of Benefit Plans, International Benefit Rules",1
,Payroll Compliance,Payroll Tax Essentials,"Understanding Payroll Taxes, Federal and State Tax Compliance, Payroll Tax Filing Procedures, Managing Employer Tax Contributions, Payroll Tax Deductions, Dealing with Tax Notices and Penalties, Payroll Tax Planning Strategies, Year-End Tax Adjustments, Payroll Tax Audits, Future Changes in Payroll Taxation",1
,Payroll Compliance,Year-End Payroll Prep,"Preparing for Year-End Processing, W-2 and 1099 Reporting, Year-End Tax Adjustments, Verifying Employee Information, Handling Bonus and Holiday Pay, Year-End Checklist, Compliance with Year-End Regulations, Software Updates for Year-End, Communicating with Employees, Planning for the New Year
",1
,Payroll Compliance,Garnishment Compliance,"Understanding Wage Garnishment Laws, Processing Garnishments in Payroll, Prioritizing Multiple Garnishments, State-Specific Garnishment Rules, Communicating with",1
,Payroll Compliance,Payroll for Startups,"Payroll for Startups: Setting Up Your First Payroll System, Understanding Payroll Compliance, Budgeting for Payroll Expenses, Choosing Payroll Software for Startups, Managing Payroll as a Startup Founder, Employee Classification in Startups, Payroll Reporting for Small Businesses, Startup Tax Credits and Incentives, Payroll Challenges for Growing Startups, Outsourcing vs. In-House Payroll",1
,Payroll Compliance,Payroll Recordkeeping,"Essential Payroll Records to Maintain, Legal Requirements for Payroll Records, Best Practices in Recordkeeping, Digital vs. Paper Records, Data Security in Payroll Recordkeeping, Retention Periods for Payroll Records, Recordkeeping for Audits, Organizing Employee Payroll Files, Recordkeeping Compliance, Tools and Software for Payroll Recordkeeping",1
,Payroll Compliance,Global Payroll Trends,"Navigating International Payroll Compliance, Technology Advancements in Global Payroll, Outsourcing vs. In-House Global Payroll, Currency and Exchange Rate Challenges, Country-Specific Payroll Regulations, Global Payroll Reporting Standards, Managing Multi-Country Payroll, Employee Mobility and Payroll, Global Payroll Data Security, Future Trends in Global Payroll Management",1
,Payroll Compliance,Payroll in Mergers,"Payroll Integration Challenges, Harmonizing Payroll Systems, Merging Payroll Policies and Procedures, Compliance in Mergers and Acquisitions, Communication Strategies for Payroll Changes, Managing Employee Data Transfers, Payroll System Consolidation, Post-Merger Payroll Audits, Cultural Considerations in Mergers, Long-Term Payroll Strategy Post-Merger",1
,Payroll Compliance,Freelancer Pay Laws,"Understanding Independent Contractor Regulations, Tax Implications for Freelancer Pay, Classifying Freelancers vs. Employees, Best Practices for Paying Freelancers, Freelancer Payment Agreements, Managing International Freelancer Payments, Recordkeeping for Freelancer Payments, Legal Risks in Freelancer Pay, Freelancer Pay Dispute Resolution, Future Trends in Freelancer Legislation",1
,Startup Payroll,Startup Payroll and Compliance,"Understanding Legal Obligations, Setting Up Initial Payroll Systems, Navigating Federal and State Taxes, Compliance for Employee Benefits, Avoiding Common Payroll Mistakes, Recordkeeping for Startups, Classifying Employees Correctly, Importance of Payroll Audits, Developing a Payroll Compliance Strategy, Keeping Up with Legislative Changes",1
,Startup Payroll,Scalable Payroll Solutio,"Evaluating Payroll Systems for Growth, Integrating Payroll with HR Software, Automation in Scalable Payroll, Managing Payroll During Expansion, Cloud-Based Payroll Solutions, Customization for Business Needs, Data Security in Scalable Solutions, Cost-Effective Scalable Payroll, Training Staff on New Systems, Scaling Internationally with Payroll",1
,Startup Payroll,Payroll for New Ventures,"Setting Up Payroll in a Startup, Budgeting for Payroll Expenses, Choosing a Payroll Processing Method, Payroll Compliance for New Businesses, Efficient Payroll Management Strategies, Payroll Reporting for Startups, Handling Payroll Taxes, Employee Payment Options, Technology Solutions for New Ventures, Outsourcing vs. In-House Payroll",1
,Startup Payroll,Equity Compensation 101,"Basics of Equity Compensation, Types of Equity Awards, Tax Implications of Equity Compensation, Structuring Equity Plans, Equity Compensation and Compliance, Communicating Equity to Employees, Vesting Schedules and Payroll, Equity Compensation in Funding Rounds, Valuation and Equity Awards, Recordkeeping for Equity Compensation",1
,Startup Payroll,Startup Tax Deductions,"Maximizing Tax Deductions, Payroll Tax Deductions for Startups, Understanding Depreciation and Expenses, Research and Development Tax Credits, Deducting Employee Benefits, Tax Planning Strategies, Navigating State-Specific Deductions, Tracking Expenses for Deductions, Common Tax Mistakes to Avoid, Year-End Tax Considerations",1
,Startup Payroll,Efficient Payroll Setup,"Steps for Setting Up Payroll, Choosing the Right Payroll Software, Streamlining Payroll Processes, Automating Payroll Tasks, Efficient Time and Attendance Tracking, Managing Payroll Taxes Efficiently, Setting Up Direct Deposit, Employee Self-Service Portals, Training for Payroll Efficiency, Maintaining Compliance in Payroll Setup",1
,Startup Payroll,Payroll Tech for Startups,"Latest Trends in Payroll Technology, Cloud-Based Payroll Solutions, Mobile Payroll Apps for Startups, Integrating Payroll with Accounting Software, Automated Payroll Reporting, Advanced Payroll Analytics, Employee Self-Service Tools, Security Features in Payroll Tech, Choosing Tech Solutions for Your Startup, Future of Payroll Technology",1
,Startup Payroll,Managing Payroll Costs,"Strategies for Cost-Effective Payroll, Analyzing Payroll Expenses, Reducing Payroll Processing Costs, Outsourcing vs. In-House Payroll Analysis, Efficient Employee Time Management, Negotiating with Payroll Vendors, Tax Saving Strategies in Payroll, Managing Overtime Costs, Payroll Cost Control During Growth, Auditing Payroll for Cost Savings",1
,Startup Payroll,Payroll Outsourcing Pros,"Advantages of Outsourcing Payroll, Selecting a Payroll Service Provider, Cost-Benefit Analysis of Outsourcing, Managing the Transition to Outsourced Payroll, Security Considerations in Outsourcing, Outsourcing for Compliance and Efficiency, Customization in Payroll Outsourcing, Communication with Outsourced Providers, Evaluating Outsourcing Performance, Scaling with an Outsourced Payroll Partner",1
,Startup Payroll,Payroll in Funding Rounds,"Payroll Management During Capital Raising, Equity Compensation and Funding Rounds, Budgeting for Payroll in Different Stages, Financial Reporting for Investors, Compliance in Payroll during Funding, Negotiating Payroll Terms with Investors, Payroll Strategies Post-Funding, Maintaining Payroll Flexibility, Investor Expectations and Payroll, Long-Term Payroll Planning",1
,Startup Payroll,Employee vs. Contractor,"Classifying Workers Correctly, Payroll Implications of Classification, Tax Differences Between Employees and Contractors, Legal Risks of Misclassification, Contractual Agreements with Contractors, Payroll Reporting for Different Classifications, Benefits and Compensation Strategies, Managing a Mixed Workforce, Compliance Audits for Worker Classification, Recent Legislation and Trends",1
,Startup Payroll,Payroll Reporting Basics,"Essential Payroll Reports, Compliance Reporting Requirements, Efficient Payroll Data Management, Payroll Reporting for Decision Making, Automation in Payroll Reporting, Customizing Payroll Reports, Security in Payroll Reporting, Analyzing Payroll Reports for Insights, Reporting for Multi-State Operations, Year-End Payroll Reporting",1
,Startup Payroll,Startups: Benefits Setup,"Establishing Employee Benefits, Integrating Benefits with Payroll, Cost-Efficient Benefit Strategies, Communicating Benefits to Employees, Compliance in Benefit Administration, Technology Solutions for Benefits, Tailoring Benefits to Company Culture, Managing Benefits During Growth, Outsourcing Benefits Administration, Employee Feedback on Benefits",1
,Startup Payroll,Navigating Payroll Taxes,"Understanding Payroll Tax Obligations, Federal and State Tax Compliance, Managing Payroll Tax Calculations, Tax Credits for Startups, Payroll Tax Reporting Best Practices, Addressing Tax Notices and Penalties, Strategies for Tax Efficiency, Payroll Tax Software Solutions, Keeping Up with Tax Law Changes, Planning for Tax Audits",1
,Startup Payroll,Remote Teams’ Payroll,"Payroll for a Global Workforce, Tax Considerations for Remote Employees, Currency and Exchange Rate Challenges, Legal Implications of International Payroll, Time Zone Management in Payroll, Technology Solutions for Remote Teams, Data Security for Remote Payroll, Communicating with Remote Employees, Payroll Policies for Remote Workers, Managing Benefits for Remote Teams",1
,Startup Payroll,Payroll Compliance Tips,"Best Practices for Payroll Compliance, Keeping Up with Regulatory Changes, Avoiding Common Compliance Mistakes, Training for Compliance, Payroll Compliance Checklists, Internal Audits for Compliance, Dealing with Compliance Violations, Documenting Compliance Processes, Employee Classification and Compliance, Future Compliance Trends",1
,Startup Payroll,Payroll Software for SMBs,"Selecting the Right Payroll Software, Features to Look for in SMB Payroll Software, Integrating Payroll with Other Business Systems, Cost Considerations for SMBs, User-Friendly Payroll Solutions, Security Features in Payroll Software, Evaluating Software Providers, Customization Options, Training Employees on New Software, Future-Proofing Your Payroll Software",1
,Payroll Software,Automated Payroll Solutions,"Benefits of Automation in Payroll, Implementing Automated Payroll Systems, Streamlining Payroll Processes, Automated Tax Calculations, Integration with Time Tracking, Reducing Errors with Automation, Reporting Features in Automated Systems, Cost Savings in Automation, Automated Compliance Updates, Evaluating Automated Payroll Providers",1
,Payroll Software,Software Integrations,"Integrating Payroll with Accounting Software, HR System Integration, Benefits of Seamless Software Integration, Automated Data Transfer and Synchronization, Custom Integration Solutions, Security in Software Integration, Managing Multi-System Integration, Integration with Time and Attendance Systems, Enhancing Reporting through Integration, Choosing Integration-Friendly Payroll Software",1
,Payroll Software,Cloud-Based Payroll,"Advantages of Cloud Payroll Systems, Migrating to Cloud-Based Payroll, Security Measures in Cloud Payroll, Accessibility and Mobility Benefits, Cost-Effectiveness of Cloud Solutions, Scaling Payroll with Cloud Systems, Data Backup and Recovery in Cloud, Cloud Compliance Features, Customization Options in Cloud Payroll, Selecting a Cloud Payroll Provider",1
,Payroll Software,Payroll Mobile Apps,"Features of Payroll Mobile Applications, Benefits of Mobile Access to Payroll, Security in Mobile Payroll Apps, Integration with Cloud-Based Systems, Employee Self-Service via Mobile, Real-Time Payroll Management on Mobile, Customizing Mobile App Features, Mobile Apps for Time Tracking, Choosing a Payroll App, Future Trends in Mobile Payroll",1
,Payroll Software,AI in Payroll Systems,"Implementing AI in Payroll Management, AI for Enhanced Data Analysis, Automating Payroll Tasks with AI, Predictive Analytics in Payroll, AI in Fraud Detection and Compliance, Personalized Experiences with AI, AI and Payroll Forecasting, Challenges and Considerations in AI Adoption, AI in Employee Self-Service, Future of AI in Payroll Systems",1
,Payroll Software,Payroll Data Security,"Ensuring Data Security in Payroll, Best Practices for Payroll Data Protection, Encryption and Secure Data Storage, Compliance with Data Protection Regulations, Risk Management in Payroll Data, Employee Training on Data Security, Securing Cloud-Based Payroll Data, Handling Data Breaches, Regular Security Audits, Advanced Security Technologies in Payroll",1
,Payroll Software,Custom Payroll Reports,"Creating Customized Payroll Reports, Importance of Tailored Reporting, Tools for Custom Report Generation, Analyzing Payroll Data through Reports, Sharing and Exporting Custom Reports, Security in Custom Reporting, Custom Reports for Compliance, Engaging Stakeholders with Reports, Automation in Report Creation, Training on Report Tools",1
,Payroll Software,SaaS Payroll Solutions,"Advantages of SaaS for Payroll, Comparing SaaS Payroll Providers, Cost-Effective SaaS Options, Scalability in SaaS Solutions, Updating and Maintaining SaaS Payroll, Security Considerations for SaaS, Customization in SaaS Platforms, Integration Capabilities of SaaS, Transitioning to a SaaS System, Future of SaaS in Payroll",1
,Payroll Software,Payroll & HR Software,"Integrated Payroll and HR Systems, Benefits of Unified HR and Payroll, Managing Employee Data, Streamlining HR and Payroll Processes, Compliance Management in Integrated Systems, Analytics and Reporting Features, Self-Service Portals for Employees, Choosing an Integrated System, Training on Integrated Platforms, Trends in HR and Payroll Software",1
,Payroll Software,Real-Time Payroll Data,"Accessing Payroll Data in Real-Time, Benefits of Immediate Data Availability, Real-Time Reporting and Analysis, Implementing Real-Time Payroll Systems, Integration with Live Data Feeds, Enhancing Decision Making with Real-Time Data, Security in Real-Time Systems, Challenges with Real-Time Data Management, Real-Time Data in Remote Work, Future of Real-Time Payroll",1
,Payroll Software,Small Biz Payroll Tools,"Payroll Solutions for Small Businesses, Cost-Effective Tools for Small Biz, Simplifying Payroll in Small Companies, Compliance Features for Small Businesses, Integrating Payroll with Other Small Biz Tools, Automated Payroll Features, User-Friendly Interfaces, Customizing Payroll for Small Businesses, Evaluating Small Biz Payroll Providers, Future of Small Business Payroll",1
,Payroll Software,Payroll for Large Teams,"Managing Payroll for Large Workforces, Scalable Solutions for Big Teams, Integration with Enterprise Systems, Complex Compliance Management, Automated Payroll for Efficiency, Custom Reporting for Large Teams, Data Security in Large Scale Payroll, Training Staff on Large Team Payroll, Evaluating Enterprise Payroll Providers, Trends in Payroll for Large Teams",1
,Payroll Software,User-Friendly Payroll,"Designing an Intuitive Payroll System, Easy-to-Navigate Payroll Software, Simplifying Payroll Processes, User Experience in Payroll Design, Training for User-Friendly Systems, Features for Non-Technical Users, Feedback and Improvement in Usability, Mobile User Experience, Security and Simplicity Balance, Selecting User-Friendly Payroll Software",1
,Payroll Software,Payroll Tax Calculators,"Importance of Accurate Tax Calculation, Automated Tax Calculator Features, Integrating Tax Calculators with Payroll, Ensuring Compliance with Tax Calculators, Updates and Maintenance of Tax Calculators, User-Friendly Tax Calculation Tools, Accuracy and Reliability in Calculations, Customizable Tax Parameters, Evaluating Tax Calculator Software, Future of Payroll Tax Technology",1
,Payroll Software,Multi-Country Payroll,"Managing Payroll Across Borders, Compliance in International Payroll, Currency and Exchange Rate Management, Cultural Considerations in Global Payroll, Technology for Multi-Country Payroll, Centralized vs. Decentralized Global Payroll, Data Security in International Context, Training for Multi-Country Payroll Management, Evaluating Global Payroll Providers, Future Trends in Global Payroll",1
,Payroll Software,Payroll Compliance Tech,"Technology Solutions for Payroll Compliance, Automated Compliance Updates, Monitoring Regulatory Changes, Compliance Reporting Tools, Risk Management with Compliance Tech, Data Protection and Privacy Compliance, User Training on Compliance Technology, Evaluating Compliance Tech Solutions, Integrating Compliance into Payroll Processes, Future of Compliance Technology",1
,Payroll Software,Scalable Payroll Systems,"Payroll Systems for Growing Businesses, Scaling Payroll with Company Growth, Flexible and Adaptable Payroll Solutions, Automation in Scalable Payroll, Integrating Scalable Systems with HR, Cost Management in Scalable Systems, Security Considerations for Scaling, Training on Scalable Systems, Evaluating Scalable Payroll Providers, Preparing for Future Growth in Payroll",1
,Global Payroll,Global Payroll Management,"Navigating International Payroll Complexities, Integrating Payroll Systems Globally, Compliance Across Different Jurisdictions, Managing Currency Fluctuations, Technology Solutions for Global Payroll, Payroll Reporting on an International Scale, Cultural Considerations in Global Payroll, Data Security in International Payroll, Training Teams for Global Payroll Management, Future Trends in Global Payroll",1
,Global Payroll,Payroll for Remote Teams,"Handling Payroll for Geographically Dispersed Teams, Tax Implications for Remote Employees, Currency and Payment Challenges, Legal Considerations for Remote Work Payroll, Developing Remote Payroll Policies, Technology Solutions for Remote Payroll, Managing Time and Attendance from Afar, Cultural Sensitivity in Payroll Processing, Data Security for Remote Payroll Systems, Best Practices for Remote Team Payroll",1
,Global Payroll,Multi-Country Payroll Tips,"Efficient Management of Multi-Country Payroll, Navigating Different Payroll Regulations, Currency Conversion and Consolidation Strategies, Centralized vs. Decentralized Payroll Models, Technology Integration Across Multiple Countries, Handling Tax Compliance in Different Jurisdictions, Cultural Nuances in Payroll Processing, Streamlining Payroll Workflows Internationally, Employee Communication and Support, Continuous Improvement in Multi-Country Payroll",1
,Global Payroll,Payroll in Different Currencies,"Managing Payroll in Multiple Currencies, Currency Conversion and Exchange Rate Challenges, Payroll Software for Multi-Currency Management, Minimizing Financial Risks with Currency Fluctuations, Compliance with Currency Control Regulations, Efficient Payment Processing in Different Currencies, Transparent Communication about Currency Impact, Accounting Considerations for Multi-Currency Payroll, Training Staff on Currency Management, Future Technologies in Currency Handling",1
,Global Payroll,Global Payroll Tax Laws,"Understanding International Tax Regulations, Navigating Cross-Border Tax Compliance, Managing Withholding Taxes Internationally, Double Taxation Avoidance Agreements, Country-Specific Tax Law Variances, Tax Implications for Expatriate Employees, Technology to Support Tax Law Compliance, Reporting and Documentation for Global Taxes, Consulting with Tax Experts, Staying Updated on Global Tax Changes",1
,Global Payroll,Payroll for Expats,"Payroll Considerations for Expatriate Employees, Tax Implications for Expats, Navigating Work Permits and Visa Regulations, Currency and Compensation Strategies for Expats, Cultural and Legal Adjustments in Payroll, Benefits and Retirement Plans for Expats, Data Security and Privacy Concerns, Liaising with Local and Home Country Authorities, Repatriation and Payroll Transition, Best Practices for Expatriate Payroll Management",1
,Global Payroll,Global Payroll Software,"Selecting Software for Global Payroll Needs, Integrating Global Payroll Systems, Customization for Local Compliance, Scalability in Global Payroll Software, Data Consolidation and Reporting Features, User Experience in Diverse Environments, Security Measures in Global Software, Training and Support for Software Use, Evaluating Global Payroll Vendors, Future Developments in Payroll Technology",1
,Global Payroll,International Payroll Errors,"Common Mistakes in Global Payroll Processing, Preventing Errors in International Payroll, Impact of Payroll Errors on Compliance, Rectifying Payroll Mistakes Across Borders, Automated Checks for Error Prevention, Training for Error Awareness and Management, Communication Strategies Post-Error, Analyzing Root Causes of Payroll Errors, Technology Solutions to Minimize Errors, Building a Culture of Accuracy in Payroll",1
,Global Payroll,Payroll Compliance Abroad,"Ensuring Compliance in International Payroll, Navigating Different Labor Laws, Managing Payroll in Regulatory Complex Regions, Keeping Up with Compliance Changes, Risk Management in Overseas Payroll, Compliance Training for Payroll Teams, Auditing for International Compliance, Partnering with Local Experts, Documentation and Record-Keeping, Strategies for Global Compliance Management",1
,Global Payroll,Managing Overseas Employees,"Effective Payroll Management for Overseas Staff, Navigating Cultural Differences in Payroll, Legal Requirements for International Employees, Currency and Compensation Strategies, Communication and Engagement with Overseas Teams, Technology Tools for Managing Remote Employees, Performance and Time Tracking Challenges, Benefits and Pension Management Abroad, Data Security for Overseas Employee Information, Developing Global HR Policies",1
,Global Payroll,Payroll in Emerging Markets,"Payroll in Emerging Markets: Challenges and Opportunities in Emerging Markets Payroll, Adapting to Local Regulations and Customs, Building Payroll Infrastructure in New Markets, Navigating Economic and Currency Volatility, Leveraging Technology in Emerging Markets, Training and Development for Local Teams, Partnering with Local Entities, Balancing Global Standards with Local Needs, Risk Assessment and Management, Long-Term Strategy for Emerging Market Payroll",1
,Industry Payroll,Restaurant Payroll,"Navigating Tip Reporting and Allocation, Payroll Compliance for Restaurant Staff, Handling Overtime and Split Shifts, Payroll Software for Restaurants, Tax Credits and Deductions in Restaurant Payroll, Managing Seasonal Staffing Fluctuations, Payroll Challenges in the Food Service Industry, Employee Classification in Restaurants, Streamlining Payroll Processes, Employee Benefits and Compensation",1
