Main Keyword,Pillar Topic,Blog Post,Blog Post Outline,Search Volume
,Industry Payroll,Corporate Payroll,"Managing Payroll in Large Enterprises, Compliance in a Corporate Setting, Automating Corporate Payroll Processes, Payroll Reporting and Analysis, Executive Compensation and Bonuses, Global Payroll Management, Integrating Payroll with Corporate HR Systems, Data Security in Corporate Payroll, Corporate Payroll Tax Strategies, Employee Benefits and Retirement Plans",1
,Industry Payroll,Small Business Payroll,"Setting Up Payroll for Small Businesses, Cost-Effective Payroll Solutions, Navigating Payroll Taxes and Compliance, Payroll Software Options for Small Businesses, Managing Payroll as a Small Business Owner, Employee Classification Challenges, Streamlining Payroll Administration, Small Business Tax Credits, Recordkeeping and Reporting Requirements, Payroll for Part-Time and Seasonal Workers",1
,Industry Payroll,Manufacturing Payroll,"Payroll Challenges in Manufacturing Industry, Compliance with Labor Laws, Handling Shift Differentials and Overtime, Payroll Systems for Manufacturing, Union Payroll Requirements, Safety Incentives and Payroll, Benefits Administration in Manufacturing, Time Tracking and Payroll, Tax Issues Specific to Manufacturing, Managing Seasonal Workforce Payroll",1
,Industry Payroll,Non-Profit Payroll,"Payroll Management in the Non-Profit Sector, Tax Exemption Challenges and Benefits, Budgeting for Payroll in Non-Profits, Compliance with Charitable Organization Regulations, Managing Volunteer and Employee Payroll, Grant Funding and Payroll Allocation, Payroll Software for Non-Profits, Employee Benefits and Compensation in Non-Profits, Recordkeeping and Reporting, Payroll Challenges Unique to Non-Profits",1
,Industry Payroll,Healthcare Payroll,"Managing Payroll in the Healthcare Industry, Compliance with Healthcare Regulations, Payroll for Diverse Healthcare Staff, Handling Shift Differentials and On-Call Pay, Benefits and Compensation in Healthcare, Integrating Payroll with Timekeeping Systems, Data Security and Privacy in Healthcare Payroll, Navigating Union and Contract Worker Pay, Payroll Challenges during Healthcare Crises, Healthcare Payroll Reporting Requirements",1
,Industry Payroll,Healthcare Payroll Rules,"Understanding Healthcare Payroll Regulations, Compliance with Labor Laws in Healthcare, Payroll for Medical Professionals, Managing Overtime and Shift Work, Reporting and Documentation in Healthcare Payroll, Tax Considerations in Healthcare, Payroll Software for Healthcare Settings, Benefits Administration for Healthcare Workers, Navigating Payroll in a Hospital Setting, Keeping up with Changes in Healthcare Laws",1
,Industry Payroll,Payroll in Tech Industry,"Payroll Considerations in the Technology Sector, Equity and Stock Options in Tech Payroll, Managing Payroll for Remote Tech Teams, Startups vs Established Tech Companies Payroll, Compliance in the Tech Industry, Benefits and Perks in Tech Payroll, Data Security and Confidentiality, Payroll Software Solutions for Tech Companies, Payroll Challenges in Fast-Growing Tech Firms, International Payroll for Tech Employees",1
,Industry Payroll,Retail Payroll Management,"Retail Payroll Challenges and Solutions, Compliance in Retail Industry, Managing Seasonal and Part-Time Staff Payroll, Payroll Software for Retail Businesses, Tax Strategies for Retail Businesses, Employee Benefits in Retail, Time Tracking and Scheduling Integration, Handling Commission-Based Pay, Retail Payroll Reporting and Analysis, Streamlining Payroll Processes in Retail",1
,Industry Payroll,Manufacturing Payroll,"Payroll Compliance in Manufacturing, Handling Overtime and Shift Pay, Payroll Software for Manufacturing, Employee Classification and Wage Issues, Managing Payroll in Unionized Settings, Safety Incentives and Compensation, Seasonal and Temporary Workforce Management, Tax Considerations in Manufacturing Payroll, Benefits Administration in Manufacturing, Manufacturing Payroll Reporting",1
,Industry Payroll,Education Sector Payroll,"Managing Payroll in Educational Institutions, Compliance with Educational Payroll Regulations, Payroll for Teachers and Adjunct Faculty, Benefits Administration in Education, Payroll Challenges during School Breaks, Retirement and Pension Plans for Educators, Payroll for Non-Teaching Staff, Time Tracking and Attendance, Tax Deductions and Credits, Payroll Reporting and Documentation",1
,Industry Payroll,Construction Payroll Tips,"Payroll Management in Construction Industry, Compliance with Construction Labor Laws, Handling Overtime and Prevailing Wage Rates, Payroll for Seasonal and Project-Based Workers, Certified Payroll Reporting Requirements, Integrating Payroll with Job Costing, Employee Classification in Construction, Payroll Software for Construction Firms, Tax Issues in Construction Payroll, Benefits and Compensation Challenges",1
,Industry Payroll,Payroll for Non-Profits,"Budgeting for Payroll in Non-Profit Organizations, Tax Exemptions and Compliance, Balancing Volunteer and Paid Staff, Grant and Donation Allocation for Payroll, Payroll Software for Non-Profits, Employee Benefits and Compensation, Managing Payroll with Limited Resources, Reporting and Transparency Requirements, Compliance with Charity Regulations, Payroll Challenges for Non-Profit Leaders",1
,Industry Payroll,Payroll in Hospitality,"Managing Payroll in Hotels and Resorts, Compliance with Hospitality Industry Standards, Tipped Employee Payroll Management, Seasonal Staffing and Payroll Challenges, Payroll Software for Hospitality Businesses, Employee Benefits in Hospitality, Time Tracking and Overtime Management, Payroll for Event and Catering Staff, International Staff Payroll Issues, Streamlining Hospitality Payroll Processes",1
,Industry Payroll,Payroll for Startups,"Setting Up Payroll in a Startup Environment, Navigating Payroll Compliance for Startups, Choosing Payroll Software for Startups, Equity Compensation and Stock Options, Managing Payroll with Limited Resources, Payroll for Co-Founders and Early Employees, Tax Considerations for Startups, Benefits and Perks in Startup Payroll, Scaling Payroll as the Startup Grows, Outsourcing vs In-House Payroll",1
,Industry Payroll,Law Firm Payroll Insights,"Payroll Management in Legal Practices, Compliance with Legal Industry Standards, Payroll for Attorneys and Paralegals, Managing Partner Compensation, Retirement Plans and Benefits for Law Firms, Trust Accounting and Payroll, Time Tracking and Billable Hours Integration, Tax Strategies for Law Firms, Payroll Software for Legal Practices, Payroll Challenges in Law Firms",1
,Industry Payroll,Payroll for Freelancers,"Managing Payroll for Independent Contractors, Tax Implications for Freelancer Payments, Invoicing and Payment Processes, Compliance with Contractor Regulations, Budgeting for Freelance Expenses, Payroll Software for Freelancer Management, International Freelancer Payment Challenges, Documenting and Reporting Freelancer Payments, Negotiating Rates and Contracts, Best Practices for Freelancer Payroll Management",1
,Industry Payroll,Agricultural Payroll,"Payroll Management in the Agricultural Sector, Compliance with Agricultural Labor Laws, Seasonal and Migrant Worker Payroll, Payroll for Piece-Rate Workers, Payroll Challenges in Farming and Agriculture, Tax Considerations for Agricultural Payroll, Benefits and Compensation in Agriculture, Payroll Software for the Agricultural Industry, Managing Payroll in Rural Areas, Safety and Wage Regulations in Agriculture",1
,Competitor Payroll,ADP vs Warp,"Comparing Feature Sets, Pricing Structure Analysis, User Experience: ADP vs Warp, Payroll Processing Capabilities, Integration and Scalability, Customer Support and Service, Compliance Features Comparison, Reporting and Analytics, Market Position and Reputation, Target Audience and Suitability",1
,Competitor Payroll,Gusto vs Warp,"Ease of Use and Interface, Payroll and Tax Management Features, Benefits Administration Comparison, Pricing and Plans, Customer Support and Resources, Integration with Other Systems, Automated Payroll Features, Employee Self-Service Portals, Market Presence and User Reviews, Small Business Suitability",1
,Competitor Payroll,OnPay vs Warp,"Core Payroll Features, Pricing and Value for Money, Customization and Flexibility, Compliance and Tax Filing Capabilities, User Interface and Ease of Navigation, Customer Service and Support, Integrations with HR and Accounting, Payroll Accuracy and Reliability, Market Position and Credibility, Ideal Business Size and Industry",1
,Competitor Payroll,Paycor vs Warp,"Comprehensive Feature Comparison, Payroll and HR Functionality, Pricing and Investment Analysis, User Experience and Interface, Reporting and Analytics Tools, Compliance and Security Features, Market Share and Industry Presence, Customer Service and Technical Support, Scalability and Growth Support, Suitability for Different Business Sizes",1
,Competitor Payroll,QuickBooks vs Warp,"Integration with Accounting Software, Feature Comparison and Capabilities, Pricing and Cost-Effectiveness, Ease of Use and Setup, Payroll Processing Efficiency, Tax Filing and Compliance Support, Customer Service and User Support, Reporting and Analytics Features, Market Position and Reliability, Suitability for Various Business Types",1
,Competitor Payroll,Warp vs. Zenefits,"Payroll vs Full HR Suite, User Interface and Navigation, Comprehensive Feature Set Comparison, Pricing and Plan Flexibility, Payroll Processing and Accuracy, Integration with Other Business Systems, Customer Support and Resources, Compliance and Tax Features, Market Reputation and User Feedback, Best Fit for Business Size and Type",1
,Competitor Payroll,Paychex vs. Warp,"Feature Range and Capabilities, Pricing and Cost Analysis, Payroll Processing Competence, Compliance and Tax Services, User Experience and Usability, Customer Support Quality, Integration with HR and Benefits, Analytics and Reporting Tools, Market Standing and Brand Strength, Business Size and Industry Suitability",1
,Competitor Payroll,Square Payroll vs. Warp,"Payroll for Retail and POS Integration, Features and Functionality, Cost and Pricing Structure, User Interface and Accessibility, Tax Filing and Compliance Support, Customer Service and User Assistance, Integration with Square Ecosystem, Reporting and Data Management, Market Position and Target Audience, Best Fit for Retail and Small Businesses",1
,Competitor Payroll,Patriot Payroll vs. Warp,"Pricing and Affordability, Core Payroll Features, User-Friendly Interface, Compliance and Tax Filing Features, Customer Support and Resources, Integration Options, Payroll Accuracy and Reliability, Reporting Capabilities, Market Position and Reviews, Suitability for Small to Medium Businesses",1
,Competitor Payroll,BambooHR vs. Warp,"HR and Payroll Integration, Feature Set and Capabilities, User Experience and Interface, Pricing and Investment Value, Payroll Processing Efficiency, Compliance and Security Features, Customer Support and Resources, Reporting and Analytics, Market Position and Credibility, Ideal for SMBs and HR Focus",1
,Competitor Payroll,Zoho Payroll vs. Warp,"Integration with Zoho Ecosystem, Feature Comparison and Usability, Pricing and Plans Analysis, Payroll Processing and Tax Compliance, User Interface and Experience, Customer Service and Technical Support, Reporting and Analytics Tools, Market Presence and User Reviews, Ideal Business Size and Industry, Scalability and Customization Options",1
,Competitor Payroll,Rippling vs. Warp,"Payroll and HR Software Integration, Advanced Features and Technology, Pricing and Cost Comparison, User Interface and Navigation, Compliance and Security Measures, Customer Support and Assistance, Integration with Other Business Tools, Market Share and Reputation, Ideal for Tech-Savvy Businesses, Reporting and Analytics Capabilities",1
,Competitor Payroll,Wave Payroll vs. Warp,"Small Business Focus, Pricing and Affordability, Payroll Features and Capabilities, User-Friendly Interface, Tax Compliance and Filing, Customer Support and Resources, Integration with Accounting Software, Reporting and Payroll Management, Market Position and User Feedback, Suitability for Freelancers and Small Businesses",1
,Competitor Payroll,Sage Payroll vs. Warp,"Feature Set for Large Enterprises, Pricing and ROI Analysis, User Interface and Usability, Compliance and Global Payroll Capabilities, Integration with Sage Products, Customer Support and Resources, Reporting and Analytics Features, Market Presence and Industry Credibility, Scalability and Customization Options, Ideal for Midsize to Large Businesses",1
,Competitor Payroll,Workday vs. Warp,"Enterprise-Level Functionality, Comprehensive HR and Payroll, Pricing and Total Cost of Ownership, User Experience and Modern Interface, Advanced Reporting and Analytics, Integration Capabilities, Market Position and Brand Strength, Customer Service and Support, Compliance and Security Features, Suitability for Large Organizations",1
,Competitor Payroll,TriNet vs. Warp,"PEO Services vs Traditional Payroll, Comprehensive Feature Comparison, Pricing and Cost Analysis, User Experience and Customization, Compliance and HR Support, Integration with Business Systems, Market Share and User Feedback, Customer Support and HR Expertise, Reporting and Analytics Tools, Ideal for SMBs with HR Needs",1
,Competitor Payroll,Ceridian vs. Warp,"Enterprise Payroll and HR Solutions, Advanced Features and Capabilities, Pricing and Investment Analysis, User Interface and Experience, Global Payroll and Compliance, Integration with HR Systems, Market Position and Credibility, Customer Support and Resources, Reporting and Workforce Management, Suitable for Large and Multinational Corporations",1
,Competitor Payroll,Namely vs. Warp,"HR-Focused Payroll Solution, Feature Set and Capabilities, Pricing and Plan Options, User Experience and Interface, Payroll and HR Integration, Compliance and Security Features, Customer Support and Resources, Reporting and Analytics, Market Presence and User Feedback, Best for Midsize Businesses with HR Focus",1
,Competitor Payroll,SurePayroll vs. Warp,"Small Business and Niche Markets, Pricing and Affordability, Payroll Features and Functionality, User Interface and Accessibility, Tax Compliance and Support, Customer Service and Resources, Integration with Accounting Tools, Reporting and Payroll Management, Market Position and Brand Recognition, Suitability for Small Businesses and Startups",1
,Competitor Payroll,Paylocity vs. Warp,"Comprehensive Payroll and HR, Advanced Feature Comparison, Pricing and Value for Money, User Experience and Customization, Integration with HR Systems, Compliance and Reporting Features, Customer Support and Services, Market Share and Industry Presence, Scalable Solutions for Growing Businesses, Analytics and Employee Engagement Tools",1